agency_item_id,state,agency,item_code,official_description,official_abbreviated_description,official_unit,canonical_item_id
co_cdot_000-00005,CO,CDOT,000-00005,Design (NFA CDOT Direct and Indirect Costs),Design (NFA CDOT),L S,
co_cdot_000-00010,CO,CDOT,000-00010,Design (Federal Aid CDOT Inc Eligible Indirects),Design (Federal Aid CDOT),L S,
co_cdot_000-00030,CO,CDOT,000-00030,Construction Engineering (Consultant),Const Engineering (Consultant),L S,
co_cdot_000-00035,CO,CDOT,000-00035,Construction Engineering (Consultant Non-Federal Aid),Const Engineering (Consultant NFA),L S,
co_cdot_000-00040,CO,CDOT,000-00040,"Construction Engineering (CDOT, Bid and F/A)","Const Engineering (CDOT, Bid and F/A)",L S,
co_cdot_000-00045,CO,CDOT,000-00045,"Construction Engineering (CDOT, Bid and F/A - NFA)","Const Engineering (CDOT, Bid & F/A NFA)",L S,
co_cdot_000-00050,CO,CDOT,000-00050,Indirect Costs (CE Only),Indirect Costs (CE Only),L S,
co_cdot_000-00100,CO,CDOT,000-00100,Environmental (Non-Fed Aid CDOT),Environmental (NFA CDOT),L S,
co_cdot_000-00105,CO,CDOT,000-00105,Environmental (Federal Aid CDOT),Environmental (Federal Aid CDOT),L S,
co_cdot_000-00110,CO,CDOT,000-00110,Environmental (Non-Federal Aid Consultant),Environmental (NFA Consultant),L S,
co_cdot_000-00115,CO,CDOT,000-00115,Environmental (Federal Aid Consultant),Environmental (Federal Aid Consultant),L S,
co_cdot_201-00000,CO,CDOT,201-00000,Clearing and Grubbing,Clear and Grub,L S,
co_cdot_201-00001,CO,CDOT,201-00001,Clearing and Grubbing,Clear and Grub,ACRE,
co_cdot_201-00002,CO,CDOT,201-00002,Clearing,Clearing,L S,
co_cdot_201-00005,CO,CDOT,201-00005,Removal of Debris,Rem of Debris,L S,
co_cdot_201-00007,CO,CDOT,201-00007,Removal of Debris,Rem of Debris,EACH,
co_cdot_201-00009,CO,CDOT,201-00009,Removal of Debris,Rem of Debris,CY,
co_cdot_201-00816,CO,CDOT,201-00816,Reset Sign Panel (Special),Res Sign Panel (Spec),EACH,
co_cdot_202-00000,CO,CDOT,202-00000,Removal of Structures and Obstructions,Rem Str and Obstructions,L S,
co_cdot_202-00001,CO,CDOT,202-00001,Removal of Structure,Rem Structure,EACH,
co_cdot_202-00002,CO,CDOT,202-00002,Removal of Structure (Special),Rem of Structure (Spec),EACH,
co_cdot_202-00003,CO,CDOT,202-00003,Removal of Structure (Special),Rem of Structure (Spec),L S,
co_cdot_202-00004,CO,CDOT,202-00004,Removal of Steel H or Pipe Piling,Rem Steel H or Pipe Piling,LF,
co_cdot_202-00005,CO,CDOT,202-00005,Removal of Temporary Supports,Rem Temporary Supports,L S,
co_cdot_202-00008,CO,CDOT,202-00008,Tree Trimming,Tree Trimming,HOUR,
co_cdot_202-00009,CO,CDOT,202-00009,Tree Trimming,Tree Trimming,L S,
co_cdot_202-00010,CO,CDOT,202-00010,Removal of Tree,Rem Tree,EACH,
co_cdot_202-00011,CO,CDOT,202-00011,Tree Trimming,Tree Trimming,EACH,
co_cdot_202-00012,CO,CDOT,202-00012,Removal of Tree Stump,Rem Tree Stump,EACH,
co_cdot_202-00013,CO,CDOT,202-00013,Removal of Erosion Mat,Rem Erosion Mat,SY,
co_cdot_202-00014,CO,CDOT,202-00014,Brush Clearing,Brush Clearing,HOUR,
co_cdot_202-00015,CO,CDOT,202-00015,Removal of Headwall,Rem Headwall,EACH,
co_cdot_202-00016,CO,CDOT,202-00016,Removal of Tree Support,Rem Tree Support,EACH,
co_cdot_202-00019,CO,CDOT,202-00019,Removal of Inlet,Rem Inlet,EACH,
co_cdot_202-00020,CO,CDOT,202-00020,Removal of Concrete Box Culvert,Rem CBC,EACH,
co_cdot_202-00021,CO,CDOT,202-00021,Removal of Manhole,Rem Manhole,EACH,
co_cdot_202-00022,CO,CDOT,202-00022,Removal of Headgate,Rem Headgate,EACH,
co_cdot_202-00023,CO,CDOT,202-00023,Removal of Embankment Protector Type 3,Rem Emb Prot Ty 3,EACH,
co_cdot_202-00024,CO,CDOT,202-00024,Removal of Embankment Protector Type 5,Rem Emb Prot Ty 5,EACH,
co_cdot_202-00025,CO,CDOT,202-00025,Removal of Ditch Lining,Rem Ditch Lining,LF,
co_cdot_202-00026,CO,CDOT,202-00026,Removal of Slope and Ditch Paving,Rem S and D Pave,SY,
co_cdot_202-00027,CO,CDOT,202-00027,Removal of Riprap,Rem Riprap,SY,
co_cdot_202-00028,CO,CDOT,202-00028,Removal of Erosion Control BMPs (Special),Rem of Eros Cntrl BMPS (Spec),L S,
co_cdot_202-00029,CO,CDOT,202-00029,Removal of Gabion,Rem Gabion,CY,
co_cdot_202-00030,CO,CDOT,202-00030,Removal of Water Service,Rem Water Service,EACH,
co_cdot_202-00031,CO,CDOT,202-00031,Removal of Fire Hydrant,Rem of Fire Hydrant,EACH,
co_cdot_202-00032,CO,CDOT,202-00032,Removal of Valve,Rem Valve,EACH,
co_cdot_202-00033,CO,CDOT,202-00033,Removal of Pipe,Rem Pipe,EACH,
co_cdot_202-00035,CO,CDOT,202-00035,Removal of Pipe,Rem Pipe,LF,
co_cdot_202-00036,CO,CDOT,202-00036,Removal of Pipe (Special),Rem of Pipe (Spec),LF,
co_cdot_202-00037,CO,CDOT,202-00037,Removal of End Section,Rem of End Section,EACH,
co_cdot_202-00039,CO,CDOT,202-00039,Removal of Bollard,Rem of Bollard,EACH,
co_cdot_202-00040,CO,CDOT,202-00040,Removal of Electrical Conduit,Rem Elec Conduit,LF,
co_cdot_202-00045,CO,CDOT,202-00045,Removal of Electrical Equipment,Rem Elec Equip,LF,
co_cdot_202-00047,CO,CDOT,202-00047,Removal of Electrical Equipment,Rem Elec Equipment,L S,
co_cdot_202-00050,CO,CDOT,202-00050,Removal of ITS Node Equipment,Rem ITS Node Equip,L S,
co_cdot_202-00055,CO,CDOT,202-00055,Removal of Fiber Optic Cable,Rem of FO Cable,LF,
co_cdot_202-00060,CO,CDOT,202-00060,Removal of Travel Time Indicator,Rem Trav Time Indicator,EACH,
co_cdot_202-00070,CO,CDOT,202-00070,Removal of Barricade,Rem Barricade,EACH,
co_cdot_202-00080,CO,CDOT,202-00080,Removal of Guard Post,Rem Guard Post,EACH,
co_cdot_202-00090,CO,CDOT,202-00090,Removal of Delineator,Rem Delineator,EACH,
co_cdot_202-00100,CO,CDOT,202-00100,Removal of Dome Channelizing Device,Rem of Dome Chan Device,EACH,
co_cdot_202-00120,CO,CDOT,202-00120,Removal of Concrete Box Culvert,Rem CBC,LF,
co_cdot_202-00127,CO,CDOT,202-00127,Removal of Riprap,Rem of Riprap,CY,
co_cdot_202-00150,CO,CDOT,202-00150,Removal of Wall,Rem Wall,EACH,
co_cdot_202-00155,CO,CDOT,202-00155,Removal of Wall,Rem Wall,LF,
co_cdot_202-00160,CO,CDOT,202-00160,Removal of Wall,Rem Wall,SF,
co_cdot_202-00165,CO,CDOT,202-00165,Removal of Wall,Rem Wall,L S,
co_cdot_202-00170,CO,CDOT,202-00170,Grinding And Texturing Concrete Pavement,Grinding And Texturing Conc Pvmt,SY,
co_cdot_202-00172,CO,CDOT,202-00172,Diamond Grinding Concrete Pavement,Diamond Grinding Concrete Pavement,SY,
co_cdot_202-00175,CO,CDOT,202-00175,Removal of Concrete,Rem Concrete,L S,
co_cdot_202-00190,CO,CDOT,202-00190,Removal of Concrete Median Cover Material,Rem of Conc Median Cover Matl,SY,
co_cdot_202-00195,CO,CDOT,202-00195,Removal of Median Cover,Rem of Median Cover,SY,
co_cdot_202-00200,CO,CDOT,202-00200,Removal of Sidewalk,Rem Sidewalk,SY,
co_cdot_202-00201,CO,CDOT,202-00201,Removal of Curb,Rem Curb,LF,
co_cdot_202-00202,CO,CDOT,202-00202,Removal of Gutter,Rem Gutter,LF,
co_cdot_202-00203,CO,CDOT,202-00203,Removal of Curb and Gutter,Rem Curb and Gutter,LF,
co_cdot_202-00204,CO,CDOT,202-00204,"Removal of Curb, Gutter and Sidewalk","Rem C, G and Sidewalk",LF,
co_cdot_202-00205,CO,CDOT,202-00205,Removal of Wheel Stop,Rem Wheel Stop,EACH,
co_cdot_202-00206,CO,CDOT,202-00206,Removal of Concrete Curb Ramp,Rem Conc Curb Ramp,SY,
co_cdot_202-00207,CO,CDOT,202-00207,Removal of Brick Pavers,Rem of Brick Pavers,SY,
co_cdot_202-00210,CO,CDOT,202-00210,Removal of Concrete Pavement,Rem Conc Pavement,SY,
co_cdot_202-00212,CO,CDOT,202-00212,Removal of Concrete Pavement (Special),Rem Conc Pavement (Spec),SY,
co_cdot_202-00215,CO,CDOT,202-00215,Removal of Concrete Pavement (Planing),Rem Conc Pvmt (Planing),SY,
co_cdot_202-00217,CO,CDOT,202-00217,Remove Concrete Pavement (Planing) (Special),Rem Conc Pvmt (Planing) (Spec),SY,
co_cdot_202-00220,CO,CDOT,202-00220,Removal of Asphalt Mat,Rem Asphalt Mat,SY,roadway_pavement_removal
co_cdot_202-00222,CO,CDOT,202-00222,Removal of Detour Pavement,Removal of Detour Pavement,SY,
co_cdot_202-00226,CO,CDOT,202-00226,Removal of Asphalt Mat (Special),Rem of Asph Mat (Special),SY,
co_cdot_202-00240,CO,CDOT,202-00240,Removal of Asphalt Mat (Planing),Rem Asphalt Mat (Planing),SY,
co_cdot_202-00241,CO,CDOT,202-00241,Removal of Asphalt Mat (Planing)(Special),Rem of Asph Mat (Planing)(Spec),CY,
co_cdot_202-00245,CO,CDOT,202-00245,Removal of Asphalt Mat (Planing),Rem Asphalt Mat (Planing),TON,
co_cdot_202-00246,CO,CDOT,202-00246,Removal of Asphalt Mat (Planing) (Special),Rem Asphalt Mat (Planing)(Special),SY,
co_cdot_202-00247,CO,CDOT,202-00247,Removal of Asphalt Mat (Planing),Rem Asphalt Mat (Planing),L S,
co_cdot_202-00248,CO,CDOT,202-00248,Removal of Rumble Strips,Rem Rumble Strips,LF,
co_cdot_202-00250,CO,CDOT,202-00250,Removal of Pavement Marking,Rem Pavement Marking,SF,
co_cdot_202-00251,CO,CDOT,202-00251,Removal of Pavement Marking (Asphalt Grooving),Rem Pvmt Marking (Asph Grooving),SF,
co_cdot_202-00252,CO,CDOT,202-00252,Removal of Pavement Marking (Concrete Grooving),Rem Pvmt Marking (Conc Grooving),SF,
co_cdot_202-00254,CO,CDOT,202-00254,Removal of Pavement Marking (12 Inch),Rem of Pvmt Mkg (12 In),SF,
co_cdot_202-00256,CO,CDOT,202-00256,Removal of Pavement Marking (15 Inch),Rem of Pvmt Mkg (15 In),SF,
co_cdot_202-00260,CO,CDOT,202-00260,Removal of Pavement Marking (On-Call),Rem of Pvmt Mkg (On-Call),SF,
co_cdot_202-00300,CO,CDOT,202-00300,Removal of Building(s),Rem Bldg(s),L S,
co_cdot_202-00400,CO,CDOT,202-00400,Removal of Bridge,Rem Bridge,EACH,
co_cdot_202-00401,CO,CDOT,202-00401,Removal of Bridge (Special),Rem Bridge (Spec),EACH,
co_cdot_202-00405,CO,CDOT,202-00405,Removal of Piling,Rem of Pilling,EACH,
co_cdot_202-00410,CO,CDOT,202-00410,Removal of Mat From Bridge,Rem Mat From Br,SY,
co_cdot_202-00420,CO,CDOT,202-00420,Removal of Pedestrian Rail,Rem Ped Rail,LF,
co_cdot_202-00425,CO,CDOT,202-00425,Removal of Bridge Railing,Rem Bridge Railing,LF,
co_cdot_202-00426,CO,CDOT,202-00426,Removal of Bridge Railing (Special),Rem Bridge Railing (Spec),LF,
co_cdot_202-00450,CO,CDOT,202-00450,Removal of Portions of Present Structure (Class 1),Rem Port Present Str (1),SY,
co_cdot_202-00453,CO,CDOT,202-00453,Removal of Portions of Present Structure (Class 2),Rem Port Present Str (2),SY,
co_cdot_202-00457,CO,CDOT,202-00457,Removal of Portions of Present Structure (Class 2) (Hydrodemolition),Rem of Portions of Pres Str(2) Hydrodemo,SY,
co_cdot_202-00458,CO,CDOT,202-00458,Removal of Portions of Present Structure (Hydrodemolition)(Fast-Track),Rem Port Pres Str (Hydrodem)(Fast-,SY,
co_cdot_202-00460,CO,CDOT,202-00460,Removal of Portions of Present Structure (Class 3),Rem Port Present Str (3),SY,
co_cdot_202-00480,CO,CDOT,202-00480,Removal of Portions of Present Structure (Special),Rem Port Present Str (Special),SY,
co_cdot_202-00495,CO,CDOT,202-00495,Removal of Portions of Present Structure,Rem Port Present Str,L S,
co_cdot_202-00500,CO,CDOT,202-00500,Removal of Portions of Present Structure,Rem Port Present Str,EACH,
co_cdot_202-00502,CO,CDOT,202-00502,Removal of Portions of Present Structure,Rem Port Present Str,CY,
co_cdot_202-00503,CO,CDOT,202-00503,Removal of Portions of Present Structure,Rem Port Present Str,SY,
co_cdot_202-00504,CO,CDOT,202-00504,Removal of Expansion Device,Rem Exp Device,LF,
co_cdot_202-00505,CO,CDOT,202-00505,Removal of Portions of Present Structure,Rem Port of Present Structure,SF,
co_cdot_202-00506,CO,CDOT,202-00506,Removal of Waterproofing Membrane,Removal of Waterproofing Membrane,SY,
co_cdot_202-00510,CO,CDOT,202-00510,Removal of Roadway Contraction Joint,Rem Contraction Jt,LF,
co_cdot_202-00514,CO,CDOT,202-00514,Removal of Anti-icing System (Special),Removal of Anti-icing System (Special),L S,
co_cdot_202-00520,CO,CDOT,202-00520,Removal of Expansion Joint Material,Rem of Exp Joint Matl,LF,
co_cdot_202-00600,CO,CDOT,202-00600,Removal of Railroad Appurtenances,Rem Railroad Appurtenances,L S,
co_cdot_202-00610,CO,CDOT,202-00610,Removal of Railroad Track,Rem of RR Track,LF,
co_cdot_202-00621,CO,CDOT,202-00621,Removal of Railroad Turnout,Rem of RR Turnout,EACH,
co_cdot_202-00700,CO,CDOT,202-00700,Removal of Light Standard,Rem Light Standard,EACH,
co_cdot_202-00705,CO,CDOT,202-00705,Removal of Light Standard Foundation,Rem Light Standard Foundation,EACH,
co_cdot_202-00710,CO,CDOT,202-00710,Removal of Power Pole,Rem Power Pole,EACH,
co_cdot_202-00715,CO,CDOT,202-00715,Removal of Closed Circuit Television Pole,Rem CCTV Pole,EACH,
co_cdot_202-00720,CO,CDOT,202-00720,Removal of Closed Circuit Camera,Rem CCTV Camera,EACH,
co_cdot_202-00725,CO,CDOT,202-00725,Removal of Existing Lighting System,Rem Ex Lighting Sys,L S,
co_cdot_202-00750,CO,CDOT,202-00750,Removal of Luminaire,Rem Luminaire,EACH,
co_cdot_202-00800,CO,CDOT,202-00800,Removal of Overpass Mounted Sign Bracket,Rem Overpass Mtd Sign Brkt,EACH,
co_cdot_202-00805,CO,CDOT,202-00805,Removal of Overhead Sign Structure,Rem Overhead Sign Str,EACH,
co_cdot_202-00806,CO,CDOT,202-00806,Removal of Walkway,Rem Walkway,LF,
co_cdot_202-00810,CO,CDOT,202-00810,Removal of Ground Sign,Rem Ground Sign,EACH,
co_cdot_202-00815,CO,CDOT,202-00815,Removal of Sign (Special),Rem of Sign (Special),EACH,
co_cdot_202-00821,CO,CDOT,202-00821,Removal of Sign Panel,Rem Sign Panel,EACH,
co_cdot_202-00823,CO,CDOT,202-00823,Removal of Dynamic Message Sign,Rem Dynamic Message Sign,EACH,
co_cdot_202-00825,CO,CDOT,202-00825,Removal of Flashing Beacon,Rem Flashing Beacon,EACH,
co_cdot_202-00827,CO,CDOT,202-00827,Removal of Pull Box,Rem of Pull Box,EACH,
co_cdot_202-00828,CO,CDOT,202-00828,Removal of Traffic Signal Equipment,Rem Traf Sig Equipment,L S,
co_cdot_202-00830,CO,CDOT,202-00830,Removal of Traffic Signal Face,Rem Traf Sig Face,EACH,
co_cdot_202-00831,CO,CDOT,202-00831,Removal of Traffic Signal Head,Rem Traf Sig Head,EACH,
co_cdot_202-00832,CO,CDOT,202-00832,Removal of Sign Panel (Special),Rem of Sign Panel (Spec),EACH,
co_cdot_202-00840,CO,CDOT,202-00840,Removal of Traffic Signal Pole,Rem Traf Sig Pole,EACH,
co_cdot_202-00842,CO,CDOT,202-00842,Removal of Mast Arm,Rem Mast Arm,EACH,
co_cdot_202-00845,CO,CDOT,202-00845,Removal of Traffic Signal Controller,Rem Traf Sig Controller,EACH,
co_cdot_202-00848,CO,CDOT,202-00848,Removal of Traffic Signal Controller and Cabinet,Rem Traf Sig Control+Cab,EACH,
co_cdot_202-00855,CO,CDOT,202-00855,Removal of Traffic Signal Controller Cabinet,Rem Traf Sig Control Cab,EACH,
co_cdot_202-00858,CO,CDOT,202-00858,Removal of Pedestal Pole,Rem Pedestal Pole,EACH,
co_cdot_202-00860,CO,CDOT,202-00860,Removal of Pedestrian Push Button,Rem Ped Push Button,EACH,
co_cdot_202-00870,CO,CDOT,202-00870,Removal of Coordination Unit,Rem Coordination Unit,EACH,
co_cdot_202-00873,CO,CDOT,202-00873,Removal of Tone Decoder,Rem Tone Decoder,EACH,
co_cdot_202-00880,CO,CDOT,202-00880,Removal of Traffic Signal Vehicle Detector Amplifier,Rem Sig Veh Detector Amp,EACH,
co_cdot_202-00882,CO,CDOT,202-00882,Removal of Traffic Signal Vehicle Detector (Magnetic Type),Rem Detector (Magnetic),EACH,
co_cdot_202-00887,CO,CDOT,202-00887,Removal of Radar Detection System,Rem Radar Detect Sys,EACH,
co_cdot_202-00888,CO,CDOT,202-00888,Removal of Video Detection System,Rem Video Detect Sys,EACH,
co_cdot_202-00889,CO,CDOT,202-00889,Removal of Detectable Warning,Rem of Detect Warning,EACH,
co_cdot_202-00890,CO,CDOT,202-00890,Removal of Span Wire Cable,Rem Span Wire Cable,LF,
co_cdot_202-00895,CO,CDOT,202-00895,Removal of Impact Attenuator,Rem of Impact Attenuator,EACH,
co_cdot_202-00900,CO,CDOT,202-00900,Removal of Concrete Footing,Rem Conc Footing,EACH,
co_cdot_202-00950,CO,CDOT,202-00950,Removal of Concrete Foundation and Slab,Rem Conc Found/Slab,SY,
co_cdot_202-01000,CO,CDOT,202-01000,Removal of Fence,Rem Fence,LF,
co_cdot_202-01010,CO,CDOT,202-01010,Removal Of Silt Fence,Rem Silt Fence,LF,
co_cdot_202-01015,CO,CDOT,202-01015,Removal of Rockfall Fence,Rem Rockfall Fence,LF,
co_cdot_202-01020,CO,CDOT,202-01020,Removal of Noise Barrier Fence,Rem Noise Barrier Fence,LF,
co_cdot_202-01030,CO,CDOT,202-01030,Removal of Road Closure Gate,Rem of Road Closure Gate,EACH,
co_cdot_202-01035,CO,CDOT,202-01035,Removal of Gate,Rem of Gate,EACH,
co_cdot_202-01130,CO,CDOT,202-01130,Removal of Guardrail Type 3,Rem Gdrail Ty 3,LF,
co_cdot_202-01135,CO,CDOT,202-01135,Removal of Guardrail Thrie Beam,Rem Gdrail Thrie Beam,LF,
co_cdot_202-01140,CO,CDOT,202-01140,Removal of Guardrail Type 4,Rem Gdrail Ty 4,LF,
co_cdot_202-01170,CO,CDOT,202-01170,Removal of Guardrail Type 7,Rem Gdrail Ty 7,LF,
co_cdot_202-01175,CO,CDOT,202-01175,Removal of Guardrail (Special),Rem of Guardrail (Spec),LF,
co_cdot_202-01180,CO,CDOT,202-01180,Removal of Median Barrier,Rem Median Barrier,LF,
co_cdot_202-01190,CO,CDOT,202-01190,Removal of Guardrail Type 9,Rem Gdrail Ty 9,LF,
co_cdot_202-01200,CO,CDOT,202-01200,Removal of High-Tension Cable Barrier,Rem High-Tension Cable Barrier,LF,
co_cdot_202-01300,CO,CDOT,202-01300,Removal of End Anchorage,Rem End Anchorage,EACH,
co_cdot_202-01400,CO,CDOT,202-01400,Removal of Cattle Guard,Removal of Cattle Guard,EACH,
co_cdot_202-04000,CO,CDOT,202-04000,Plug Structure,Plug Structure,EACH,
co_cdot_202-04001,CO,CDOT,202-04001,Plug Culvert,Plug Culvert,EACH,
co_cdot_202-04002,CO,CDOT,202-04002,Clean Culvert,Clean Culvert,EACH,
co_cdot_202-04003,CO,CDOT,202-04003,Clean Culvert (Special),Clean Culvert (Spec),EACH,
co_cdot_202-04004,CO,CDOT,202-04004,Plug Culvert (Special),Plug Culvert (Spec),EACH,
co_cdot_202-04005,CO,CDOT,202-04005,Clean Valve Box,Clean Valve Box,EACH,
co_cdot_202-04006,CO,CDOT,202-04006,Clean Culvert,Clean Culvert,HOUR,
co_cdot_202-04007,CO,CDOT,202-04007,Plug Culvert,Plug Culvert,CY,
co_cdot_202-04008,CO,CDOT,202-04008,Clean Culvert,Clean Culvert,LF,
co_cdot_202-04010,CO,CDOT,202-04010,Clean Inlet,Clean Inlet,EACH,
co_cdot_202-04040,CO,CDOT,202-04040,Clean Box Girder,Clean Box Girder,EACH,
co_cdot_202-04041,CO,CDOT,202-04041,Clean Box Girder (Forms and Debris),Clean Box Girder (F & D),SF,
co_cdot_202-04050,CO,CDOT,202-04050,Clean Expansion Joint,Clean Exp Joint,LF,
co_cdot_202-04060,CO,CDOT,202-04060,Dust Abatement,Dust Abatement,L S,
co_cdot_202-04100,CO,CDOT,202-04100,Abandon Well,Abandon Well,EACH,
co_cdot_202-04200,CO,CDOT,202-04200,Plug Storage Tank,Plug Storage Tank,EACH,
co_cdot_202-05000,CO,CDOT,202-05000,Transverse Grooving,Transverse Grooving,SY,
co_cdot_202-05002,CO,CDOT,202-05002,Sawing Concrete (2 Inch),Sawing Concrete (2 In),LF,
co_cdot_202-05004,CO,CDOT,202-05004,Sawing Concrete (4 Inch),Sawing Concrete (4 In),LF,
co_cdot_202-05006,CO,CDOT,202-05006,Sawing Concrete (6 Inch),Sawing Concrete (6 In),LF,
co_cdot_202-05008,CO,CDOT,202-05008,Sawing Concrete (8 Inch),Sawing Concrete (8 In),LF,
co_cdot_202-05010,CO,CDOT,202-05010,Sawing Concrete (10 Inch),Sawing Concrete (10 In),LF,
co_cdot_202-05011,CO,CDOT,202-05011,Sawing Concrete (10.5 Inch),Sawing Concrete (10.5 In),LF,
co_cdot_202-05019,CO,CDOT,202-05019,Sawing Concrete (Special),Sawing Concrete (Spec),LF,
co_cdot_202-05026,CO,CDOT,202-05026,Sawing Asphalt Material (6 Inch),Sawing Asphalt Mat (6 In),LF,
co_cdot_202-05030,CO,CDOT,202-05030,Sawing Asphalt Material (10 Inch),Sawing Asphalt Mat (10 In),LF,
co_cdot_202-05100,CO,CDOT,202-05100,Sandblasting Reinforcing Steel,Sandblasting Reinf Steel,SY,
co_cdot_202-05150,CO,CDOT,202-05150,Sandblasting,Sandblasting,SF,
co_cdot_202-05300,CO,CDOT,202-05300,Removal and Disposal of Paint,Rem and Disposal of Paint,L S,
co_cdot_202-05301,CO,CDOT,202-05301,Removal and Disposal of Paint,Rem and Disposal of Paint,SF,
co_cdot_202-06000,CO,CDOT,202-06000,Removal of Detour,Rem Detour,L S,
co_cdot_202-06500,CO,CDOT,202-06500,Removal of Restraining Bar,Rem of Restraining Bar,L S,
co_cdot_202-06510,CO,CDOT,202-06510,Removal of Inspection Car Rail,Rem of Inspection Car Rail,L S,
co_cdot_202-06520,CO,CDOT,202-06520,Removal of Existing Wall Panels,Rem of Existing Wall Panels,L S,
co_cdot_202-06530,CO,CDOT,202-06530,Clean Drain Pipe (Special),Clean Drain Pipe (Spec),EACH,
co_cdot_202-07000,CO,CDOT,202-07000,Obliterate Old Road,Oblit Old Road,L S,
co_cdot_202-07100,CO,CDOT,202-07100,Removal of Access Road (Special),Rem of Access Rd (Spec),L S,
co_cdot_202-07200,CO,CDOT,202-07200,Removal of Temporary Stream Crossing,Rem of Temporary Stream Crossing,EACH,
co_cdot_203-00000,CO,CDOT,203-00000,Unclassified Excavation,Uncl Excav,CY,
co_cdot_203-00010,CO,CDOT,203-00010,Unclassified Excavation (Complete In Place),Uncl Excav (CIP),CY,
co_cdot_203-00012,CO,CDOT,203-00012,Unclassified Excavation (Complete In Place) (Special),Uncl Excav (CIP) (Spec),CY,
co_cdot_203-00014,CO,CDOT,203-00014,Unclassified Excavation (River Bottom Material Salvage and Replacement),Uncl Ex (River Bttm Matl Salv and Repl),CY,
co_cdot_203-00015,CO,CDOT,203-00015,Unclassified Excavation (Channel Grading),Uncl Ex (Channel Grading),CY,
co_cdot_203-00040,CO,CDOT,203-00040,Unclassified Excavation (Special),Uncl Excav (Spec),CY,
co_cdot_203-00041,CO,CDOT,203-00041,Unclassified Excavation (Special),Uncl Excav (Spec),TON,
co_cdot_203-00050,CO,CDOT,203-00050,Unsuitable Material,Unsuitable Material,CY,
co_cdot_203-00060,CO,CDOT,203-00060,Embankment Material (Complete In Place),Emb Matl (CIP),CY,
co_cdot_203-00061,CO,CDOT,203-00061,Embankment Material (Complete In Place),Emb Matl (CIP),TON,
co_cdot_203-00062,CO,CDOT,203-00062,Embankment Material (Complete In Place) (Special),Emb Matl (CIP) (Spec),CY,
co_cdot_203-00065,CO,CDOT,203-00065,Embankment Material (Complete In Place) (R20),Emb Matl (CIP) (R20),CY,
co_cdot_203-00066,CO,CDOT,203-00066,Embankment Material (Complete In Place) (R40),Emb Matl (CIP) (R40),CY,
co_cdot_203-00100,CO,CDOT,203-00100,Muck Excavation,Muck Excav,CY,
co_cdot_203-00200,CO,CDOT,203-00200,Borrow,Borrow,CY,
co_cdot_203-00210,CO,CDOT,203-00210,Borrow (Complete In Place),Borrow (CIP),CY,
co_cdot_203-00400,CO,CDOT,203-00400,Rock Excavation,Rock Excav,CY,
co_cdot_203-00440,CO,CDOT,203-00440,Rock Excavation (Special),Rock Excav (Spec),CY,
co_cdot_203-00450,CO,CDOT,203-00450,Rock Removal,Rem Rock,EACH,
co_cdot_203-00500,CO,CDOT,203-00500,Rock Fill,Rock Fill,CY,
co_cdot_203-00510,CO,CDOT,203-00510,Rock Fill (Special),Rock Fill (Spec),CY,
co_cdot_203-00590,CO,CDOT,203-00590,Rock Placement,Rock Placement,CY,
co_cdot_203-00592,CO,CDOT,203-00592,Rock Staining,Rock Staining,SF,
co_cdot_203-00598,CO,CDOT,203-00598,Rock Scaling,Rock Scaling,HOUR,
co_cdot_203-00599,CO,CDOT,203-00599,Rock Scaler,Rock Scaler,HOUR,
co_cdot_203-00600,CO,CDOT,203-00600,Stripping,Stripping,CY,
co_cdot_203-00700,CO,CDOT,203-00700,Reclaim Pit,Reclaim Pit,EACH,
co_cdot_203-00705,CO,CDOT,203-00705,Access Pit,Access Pit,EACH,
co_cdot_203-00710,CO,CDOT,203-00710,Clay Plating (Complete In Place),Clay Plating (CIP),CY,
co_cdot_203-00840,CO,CDOT,203-00840,Expanded Polystyrene Fill,Polystyrene Fill,CY,
co_cdot_203-00850,CO,CDOT,203-00850,Expanded Polystyrene Fill (Complete In Place),Polystyrene Fill (CIP),CY,
co_cdot_203-00900,CO,CDOT,203-00900,Contaminated Soil Excavation,Contaminated Soil Excav,CY,
co_cdot_203-01000,CO,CDOT,203-01000,Irregular Channel Toe,Irregular Channel Toe,LF,
co_cdot_203-01020,CO,CDOT,203-01020,Compaction (AASHTO T 99),Compaction (AASHTO T 99),CY,
co_cdot_203-01030,CO,CDOT,203-01030,Compaction (AASHTO T 180),Compaction (AASHTO T 180),CY,
co_cdot_203-01100,CO,CDOT,203-01100,Proof Rolling,Proof Rolling,HOUR,
co_cdot_203-01140,CO,CDOT,203-01140,Rolling,Rolling,HOUR,
co_cdot_203-01200,CO,CDOT,203-01200,Roadway Insulation Material (2 Inch),Roadway Insulation Mat (2 In),SF,
co_cdot_203-01500,CO,CDOT,203-01500,Blading,Blading,HOUR,
co_cdot_203-01510,CO,CDOT,203-01510,Backhoe,Backhoe,HOUR,
co_cdot_203-01515,CO,CDOT,203-01515,Backhoe (Landscaping),Backhoe (Landscaping),HOUR,
co_cdot_203-01525,CO,CDOT,203-01525,Backhoe (Special),Backhoe (Spec),HOUR,
co_cdot_203-01548,CO,CDOT,203-01548,Pump,Pump,DAY,
co_cdot_203-01549,CO,CDOT,203-01549,Pump,Pump,HOUR,
co_cdot_203-01550,CO,CDOT,203-01550,Dozing,Dozing,HOUR,
co_cdot_203-01555,CO,CDOT,203-01555,Dozing (Landscaping),Dozing (Landscaping),HOUR,
co_cdot_203-01565,CO,CDOT,203-01565,Hydraulic Excavator,Hydraulic Excavator,HOUR,
co_cdot_203-01580,CO,CDOT,203-01580,Truck,Truck,HOUR,
co_cdot_203-01582,CO,CDOT,203-01582,Truck (Dump),Truck (Dump),HOUR,
co_cdot_203-01583,CO,CDOT,203-01583,Truck (Tractor),Truck (Tractor),HOUR,
co_cdot_203-01590,CO,CDOT,203-01590,Front End Loader (Rubber Tire),Front End Loader (Rubber),HOUR,
co_cdot_203-01592,CO,CDOT,203-01592,Front End Loader (Special),Front End Loader (Special),HOUR,
co_cdot_203-01594,CO,CDOT,203-01594,Combination Loader,Combination Loader,HOUR,
co_cdot_203-01596,CO,CDOT,203-01596,Potholing With Surveying and Stationing of U/G Utilities,Potholing W/ Surveying,L S,
co_cdot_203-01597,CO,CDOT,203-01597,Potholing,Potholing,HOUR,
co_cdot_203-01598,CO,CDOT,203-01598,Potholing (Special),Potholing (Spec),EACH,
co_cdot_203-01600,CO,CDOT,203-01600,Crane (Crawler),Crane (Crawler),HOUR,
co_cdot_203-01615,CO,CDOT,203-01615,Crane (Scaling),Crane (Scaling),HOUR,
co_cdot_203-01620,CO,CDOT,203-01620,Sweeping,Sweeping,HOUR,
co_cdot_203-01622,CO,CDOT,203-01622,Sweeping (With Pickup Broom),Sweeping (With Pickup Broom),HOUR,
co_cdot_203-01625,CO,CDOT,203-01625,Hydraulic Excavator Scaling,Hydraulic Excavator Scaling,HOUR,
co_cdot_203-02060,CO,CDOT,203-02060,Presplitting,Presplitting,LF,
co_cdot_203-02300,CO,CDOT,203-02300,Rock Scaler,Rock Scaler,HOUR,
co_cdot_203-02310,CO,CDOT,203-02310,Scaler Foreperson,Scaler Foreperson,HOUR,
co_cdot_203-02312,CO,CDOT,203-02312,Hand Scaling,Hand Scaling,HOUR,
co_cdot_203-02315,CO,CDOT,203-02315,Mechanized Scaling,Mechanized Scaling,HOUR,
co_cdot_203-02320,CO,CDOT,203-02320,Blaster,Blaster,HOUR,
co_cdot_203-02324,CO,CDOT,203-02324,Blast Vibration Monitoring,Blast Vibration Monitoring,L S,
co_cdot_203-02330,CO,CDOT,203-02330,Laborer,Laborer,HOUR,
co_cdot_204-00010,CO,CDOT,204-00010,Haul,Haul,TM,
co_cdot_206-00000,CO,CDOT,206-00000,Structure Excavation,Str Excav,CY,
co_cdot_206-00010,CO,CDOT,206-00010,Structure Excavation (Special),Str Excav (Spec),CY,
co_cdot_206-00050,CO,CDOT,206-00050,Structure Backfill (Special),Str Bkfl (Spec),CY,
co_cdot_206-00060,CO,CDOT,206-00060,Structure Backfill (Special) (Flow-Fill),Str Bkfl (Spec) (Flow-Fill),CY,
co_cdot_206-00065,CO,CDOT,206-00065,Structure Backfill (Flow-Fill),Str Bkfl (Flow-Fill),CY,
